,text,label
159,– Posttjänster och elektroniska kommunikationstjänster som bedöms vara av särskild vikt för personer med funktionsnedsättning och personer med speciella behov.,2
160,Detta ska ske i enlighet med förordningen (2018:20) om stöd för åtgärder som ger tillgång till telefoni och funktionell tillgång till internet.,0
161,"Anslagsposten får användas för övervakning av miljötillstånd i den yttre miljön, inklusive viss internationell rapportering, samt till miljömålsuppföljning.",0
162,Länsstyrelsen i Örebro län fördelar medlen till samtliga länsstyrelser.,1
163,Av medlen får högst 6 000 000 kronor användas för administration.,0
164,Tekniska högskolan bemyndigas att under 2018–2022 besluta om en årlig medlemsavgift på högst 1 200 000 kronor till EIT Raw Materials (i enlighet med beslut om höständringsbudget 2018).,0
165,Medlen får användas efter beslut av regeringen.,1
166,**FN:s stabiliseringsinsats i Mali (MINUSMA)**,2
167,Medel ska användas för att täcka utgifter inom Regeringskansliet (Finansdepartementet) för krisövningar inom ramen för Nordic Baltic Stability Group (NBSG) avseende den finansiella sektorn.,0
168,Från anslaget ska utbetalas 2 500 000 kronor till Fritidsodlingens Riksorganisation för informations- och rådgivningsverksamhet samt minst 750 000 kronor till Stiftelsen Trädgårdsodlingens elitplantstation.,0
169,Av anslaget ska minst 3 715 000 kronor användas för tilläggsutbildning för utländska veterinärer.,0
170,"Anslagsposten får användas för utgifter för insatser som bidrar till att förverkliga målet för digitaliseringspolitiken, liksom uppföljningar och utvärderingar av politiken.",0
171,"Medel från delposten får även medfinansiera insatser inom ramen för regionalfondsprogram för investeringar i tillväxt och sysselsättning och Fonden för en rättvis omställning 2021–2027, inkl. tekniskt stöd för strukturfondspartnerskapen.",0
172,Av anslagspostens medel fördelas 1 000 000 kronor efter beslut av regeringen.,0
173,Medlen får användas för bidrag för verksamhetsutveckling i enlighet med förordningen (2016:1367) om statsbidrag till allmänna samlingslokaler.,0
174,Anvisningar för avräkning av helårsstudenter och helårsprestationer finns i bilaga 1 till regleringsbrevet avseende universitet och högskolor.,1
175,Anslagsposten får användas för korta kurser som riktar sig till personermed tidigare arbetslivserfarenhet.,0
176,"Anslagsposten får användas för kostnader när det gäller regionens medverkan i grundutbildning av tandläkare (TUA-ersättning) i enlighet med det avtal som i augusti 2004 slutits mellan staten och vissa landsting om samarbete om grundutbildning av tandläkare, odontologisk forskning och utveckling av tandvården (TUA-avtalet) kompletterat med regionala avtal mellan respektive landsting och universitet.",0
177,Medlen ska användas för stipendier för studier vid College of Europe.,0
178,Avser preliminär statlig ålderspensionsavgift för 2021 om 3 274 263 383  kronor och ett regleringsbelopp för 2018 om -119 263 383  kronor.,1
179,Medlen ska betalas ut med en tolftedel per månad.,1
180,"Anslagsposten får användas för Valmyndighetens utgifter och kostnader i samband med förberedelser och genomförande av val, eventuellt extra val och omval samt därmed sammanhängande kostnader för uppföljning och utveckling.",0
181,Anslagsposten ska finansiera nedanstående satsning i enlighet med vad som presenteras i forsknings- och innovationspropositionen 2020 (prop. 2020/21:60) och budgetpropositionen för 2021 (prop. 2020/21:1).,0
182,Anslagsposten får användas för Swedacs förvaltningsutgifter.,0
183,Medel som kvarstår efter den 1 oktober får lämnas som bidrag för att förebygga skador orsakade av säl och för att ersätta inträffade sådana skador i enlighet med punkt 1. Anslagsposten får användas till smittskyddsberedskapsuppgifter med anledning av epizootilagen och zoonoslagen och lagen om provtagning på djur.,0
184,Av anslaget ska 1 177 000 kronor utbetalas till Kungl. Skogs- och Lantbruksakademien för akademiens verksamhet.,0
185,Anslagsposten får användas för utgifter för forsknings- och utvecklingsinsatser.,0
186,Anslagsposten ska användas för långtidsstipendier enligt förordningen (2019:1269) om statsbidrag till konstnärer.,0
187,"Universitetet ska senast i årsredovisningen lämna uppgifter till Regeringskansliet (Utbildningsdepartementet) om hur TUA-ersättningen har fördelats under 2022 när det gäller lokalkostnader, lönekostnader och övriga kostnader.",1
188,Jämställdhetsmyndigheten har i regleringsbrevet för 2022 tilldelats 1 000 000 kronor för fortsatt uppdrag om Pekingplattformen inom ramen för Generation Equality.,0
189,Jämställdhetsmyndigheten får använda 3 000 000 kronor för att med utgångspunkt i regeringsbeslut A2019/01517 fortsätta arbetet med ökad upptäckt av våld m.m. Jämställdhetsmyndigheten får lämna högst 1 000 000 kronor i bidrag till Nationella Nätverket för Samordningsförbund (NNS).,0
190,"Vid behov kan även sjukvårdspersonal, god man eller annan person fungera som beledsagare, och reskostnader och kostnader för resehandlingar för dessa, kan då belasta anslagsposten.",0
191,"Myndigheten för samhällsskydd och beredskap sänder ut experter inom olika områden, t.ex. sjukvård, säkerhet, HR, logistik, IT och kommunikation, minröjning, miljö och samordning.",1
